first_party,second_party,facts,first_party_winner
tony,jack,"In December 1980 , the tony State Police force was conducting an authorized wiretap on the telephone of Paul Driscoll . On December 20 , the police intercepted two phone calls from an unknown source that made reference to marijuana use that had occurred at a party the previous night at the jack ’ residence . was the police officer in charge of the Driscoll investigation , on the basis of these two calls , he drew up felony charges for the jack . The charges were presented to a state district court judge in February 1981 , the judge signed warrants for the jack ’ arrest . The jack were arrested in their home on March 19 , 1981 , taken to a police station where they were booked held for several hours before being released . When presented to a grand jury , the charges were dropped . The jack sued in district court alleged that his application for the warrants for their arrest violated their Fourth Fourteenth Amendment rights . After the evidence was presented to the jury , moved for a direct verdict , which the district court granted . The district court held that it was judge ’ s signing of the arrest warrants that was improper that an officer who believes that he is acting on correct information is entitled to immunity from prosecution . The U.S. Court of Appeals for the First Circuit reversed held that an officer is not entitled to immunity unless the officer had an “ objectively reasonable ” basis to believe that the alleged facts are sufficient to establish probable cause for an arrest warrant . ",0
tony,jack,"jack owned a private dude ranch which was intermingled with federal lands tony The previous owner had granted the Bureau of Land Management ( BLM ) right-of-way across the private land , but after jack bought the ranch he refused to re-grant it tony jack alleged that BLM officials harassed him with threats and meritless criminal charges , with the aim of forcing him to grant the government right-of-way tony jack sued the BLM officials for extortion in violation of the Racketeer Influenced and Corrupt Organizations Act ( RICO ) tony He also brought a Bivens action ( an action seeking monetary damages from a federal agent for a constitutional violation ) tony jack argued that the Fifth Amendment protects a `` right to exclude '' government officials from one 's property , and that the BLM agents had retaliated against him for his exercise of this right tony The District Court dismissed both claims , but the U.S. Court of Appeals for the Tenth Circuit reversed tony On appeal to the Supreme Court , the government argued that the BLM officials , while acting on behalf of the government , had qualified immunity and therefore could not be sued for extortion under RICO tony The government also claimed that no Bivens action could be brought , because review of the BLM 's actions was already available under the Administrative Procedure Act tony ",1
tony,jack,"In 1967 , Congress appropriated funds to the tony ( TVA ) to build the Tellico Dam . In 1973 Congress passed the Endangered Species Act ( ESA ) , which protected certain species classified as “ endangered ” . The Secretary of the Interior declared the Snail Darter endangered . The area of the Tellico Dam was its “ critical habitat ” . Although the multi-million dollar project was almost completed , the project predated the ESA , and Congress continued to appropriate funds to the project after the ESA passed , jack sued to enjoin the completion of the Dam in order to protect the Snail Darter . He argued that completing and opening the dam would violate the ESA by causing the extinction of the snail darter . The district court refused to grant the injunction and dismissed the complaint . The U.S. Court of Appeals for the Sixth Circuit reversed and remanded with instructions to issue a permanent injunction against any activities that would modify or destroy the Snail Darter ’ s critical habitat . ",0
tony,jack,"Christopher Lee jack and others were indicted on federal charges of `` conspiring to possess with intent to distribute more than 50 grams of cocaine base ( crack ) and conspiring to distribute the same . '' The Federal Bureau of Alcohol , Tobacco , and Firearms had monitored jack and others prior to their indictment and arrest . jack filed a motion for discovery or dismissal , alleging that he was selected for prosecution because he was black . The District Court granted the discovery order . It ordered the government to provide statistics on similar cases from the last three years . The government indicated it would not comply . Subsequently , the District Court dismissed the case . The government appealed . The Court of Appeals affirmed the dismissal . It held that the proof requirements for a selective-prosecution claim do not require a defendant to demonstrate that the government has failed to prosecute others who are similarly situated . ",1
tony,jack,Company provides charge card services to supermarkets and other merchants throughout the United States tony When a store decides to accept cards it must enter into a Card Acceptance Agreement tony This standard form contract outlines the basic relationship between and the merchant tony A clause within the agreement requires arbitration of all claims brought against and prohibits merchants from bringing any class action claims tony Several merchants including jack brought individual lawsuits against claiming that the Card Acceptance Agreement violates U.S. antitrust laws tony The United States District Court for the Southern District of New York consolidated the cases and moved to dismiss in order to force the merchants to arbitrate tony The district court enforced the arbitration clause and dismissed the case tony The merchants appealed and the United States Court of Appeals for the Second Circuit held that the arbitration clause in particular the class action waiver is unenforceable because it would essentially protect from antitrust suits tony further appealed and the United States Supreme Court granted certiorari tony The Court vacated the ruling and remanded for further proceedings in light of its decision in Stolt-Nielsen v. Animalfeeds International tony The appellate court reevaluated its decision and still found the class action waiver to be unenforceable tony The Supreme Court granted certiorari again to resolve this issue tony ,1
tony,jack,On June 1 1975 three men entered a restaurant in Little Rock jack and proceeded to rob and terrorize the five employees tony The two female employees were raped tony The ensuing police investigation resulted in the arrest the Ray Lee Welch and Gary Don Campbell tony On July 29 1975 the three defendants were each charged with one count robbery and two counts rape tony On August 5 the trial court appointed Harold Hall to serve as counsel for all three defendants and the date was set for their consolidated trial tony Prior to the trial Hall moved for the court to appoint separate counsel for each defendant because he felt based on information from the defendants that there would be a conflict interest in representing their cases together tony The trial court declined to appoint separate counsel tony Hall renewed the motion before the jury was empaneled and the court again denied it tony The jury returned guilty verdicts on all counts tony The jack Supreme Court affirmed tony ,1
tony,jack,"Verlindin B.V. , a Dutch Corporation , sued jack in U.S. District Court for the Southern District New York for breaching a letter credit tony Verlindin alleged that the court had jurisdiction under the Foreign Sovereign Immunities Act ( FSIA ) tony The FSIA grants jurisdiction for actions against foreign parties who are not entitled to immunity tony moved to dismiss the case due to lack subject matter jurisdiction tony The district court dismissed the case , holding that bank had sovereign immunity tony The U.S. Court Appeals for the Second Circuit affirmed , but held that the entire FSIA exceeded the scope Article III the U.S. Constitution tony ",1
tony,jack,Oneida and Herkimer counties adopted a local `` flow control '' ordinance requiring locally-produced garbage to be delivered to local publicly-owned facilities tony The filed suit in federal district court arguing that by prohibiting the export of waste and preventing waste haulers from using less expensive out-of-state facilities the ordinance ran afoul of the dormant Commerce Clause tony The Supreme Court has held that the Commerce Clause forbids any state law that regulates interstate commerce tony The District Court ruled against and held that the ordinance was constitutional because it did not discriminate against out-of-state businesses tony On appeal the U.S. Court of Appeals for the Second Circuit affirmed tony The Court of Appeals ruled that even if the ordinance imposed a slight burden on interstate commerce the effect was outweighed by the ordinance 's local benefits tony ,0
tony,jack,"In the Fort Laramie Treaty 1868 , the tony granted the Indian the Great Reservation , including the Black Hills South Dakota . Congress reneged in 1877 , passing an act that reclaimed the Black Hills . The requested compensation in 1920 . The tony Court Claims ruled against the in 1942 . Congress then established the Indian Claims Commission in 1946 . The Commission ruled that the was not barred by the Court Claims decision and ruled that Congress used its powers eminent domain in 1877 and the were therefore entitled to compensation . The Court Claims maintained that the were barred by their first case . Congress amended the Indian Claims Commission Act in 1978 , removing the judicial bar . The Court Claims then held that the were entitled to $ 17.1 million . ",0
tony,jack,tony and his fiancée-then-wife Miriam Regalado worked for the owner and operator of a stainless steel manufacturing facility in Carroll County KY. Regalado filed a complaint with the Equal Employment Opportunity Commission ( EEOC ) in September 2002 alleging that her supervisors discriminated against her based on her gender . On February 13 2003 the EEOC notified of the charge . Slightly more than three weeks later terminated tony 's employment . tony filed a complaint which alleged that he was fired in retaliation for Regalado 's EEOC charge . Retaliating in that way tony asserted violated section 704 ( a ) of Title VII which forbids an employer to `` discriminate against any of his employees ... because he has ... made a charge ... under this title . '' The U.S. District Court for the Eastern District of Kentucky dismissed tony 's complaint holding that Title VII `` does not permit third party retaliation claims . '' A divided panel of the U.S. Court of Appeals for the Sixth Circuit upheld the lower court order . But the court of appeals granted the employer 's petition for rehearing en banc . A splintered en banc court upheld the dismissal of tony 's complaint . ,1
tony,jack,"The Martins filed a class action lawsuit against the defendant companies in New Mexico state court in 1996 alleging illegal conduct with regard to auto financing and insurance contracts the parties had entered into tony The defendants removed the case to federal court on diversity jurisdiction grounds under 28 U.S.C tony §§ 1332 and 1441 tony The Martins did not object or seek remand until over a year later when they argued that their claims did not meet the $ 50,000 amount in controversy requirement for diversity jurisdiction tony The district court denied the motion agreeing with defendants ' arguments that the punitive damages attorneys ' fees and monetary relief for the named plaintiffs at issue in the case each exceeded the $ 50,000 threshold tony The Martins requested that the district court certify its order denying remand so that they could seek interlocutory review and the court denied their motion tony The plaintiffs next requested that the district court grant judgment against them so that they could appeal the decision regarding jurisdiction and the court granted their request tony The plaintiffs then appealed to the 10th Circuit and in a 2001 ruling the appellate court reversed the lower court 's ruling rejecting the arguments that the amounts sought by the plaintiffs satisfied the diversity jurisdiction requirement tony The court remanded the case with instructions to send it back to state court tony Back in district court the Martins moved for attorney 's fees and expenses under § 1447 ( c ) which provides for judicial discretion to make such an award in cases of improper removal tony The district court denied this request on the grounds that the defendants had an objectively reasonable basis for removal at the time tony The Martins again appealed to the 10th Circuit tony The appellate court affirmed the district court 's ruling explaining that the district court had applied the proper standard under 10th Circuit precedent stating that even in cases where removal was later found to be improper if it was deemed to be objectively reasonable at the time the court had discretion to deny an award of attorney 's fees and expenses under § 1447 ( c ) ; other circuits had employed a different standard tony The appellate court also agreed with the district court 's conclusion that the removal had an objectively legitimate basis at the time it occurred tony ",0
tony,jack,"Under the Prison Litigation Reform Act of 1995 ( PLRA ) , prisoners must exhaust any available administrative remedies for resolving disputes within the prison system before they can bring suit in federal court tony jack filed a grievance with the California prison system , but it was dismissed because he had waited too long to file it tony He then brought suit in federal district court tony California objected , arguing that he had not exhausted his administrative remedies , and that the fact those remedies were no longer available to him because of his delay in filing was immaterial tony The district court agreed , but the Ninth Circuit Court of Appeals reversed , finding that all of jack 's administrative remedies were `` exhausted '' because they were no longer available to him tony ",1
tony,jack,"Asserting state law claims , jack , a Kentucky native , brought suit in Kentucky state court , for injuries sustained in a construction accident , against Inc. ( ) , a Delaware corporation , and Whayne Supply Company ( Whayne ) , a Kentucky corporation tony Liberty Mutual Insurance Group ( Liberty Mutual ) , a Massachusetts corporation , later intervened in the case as a plaintiff tony Less than a year after filing his complaint jack entered into a settlement with Whayne tony immediately moved to remove the action to federal court , arguing that the settlement between jack and Whayne meant that there was complete diversity tony jack protested that complete diversity was not present because Liberty Mutual had not yet settled with Whayne , so that both Whayne and jack were still party to the lawsuit tony The District Court denied jack ' motion to remand , erroneously concluding that complete diversity was present tony Five months before the trial , Liberty Mutual and Whayne reached a settlement and the District Court dismissed Whayne from the case tony Complete diversity was present for the remainder of the case , including trial and judgment in favor of tony The Court of Appeals for the Sixth Circuit vacated the District Court 's judgment , holding that the lower court had lacked subject-matter jurisdiction at the time of removal because there was not complete diversity , and should have remanded the case to state court tony ",1
tony,jack,"jack was arrested for the murder of a ten-year-old girl who 's body he disposed of along a gravel road . State law enforcement officials engaged in a massive search for the child 's body . During the search , after responding to an officer 's appeal for assistance , jack made statements to the police ( without an attorney present ) which helped lead the searchers to the child 's body . The defendant 's Miranda rights were only read to him after his arrest . ",1
tony,jack,New York state law authorized the legal counsel for a municipality to seek an injunction against and the destruction of material deemed by the courts to be obscene tony jack Corporation Counsel for the City of New York sought such an injunction against several bookstores tony The process of review that followed was a civil rather than criminal procedure and the courts ultimately granted the injunction and sought to destroy the obscene material tony ,0
tony,jack,tony was diagnosed with Hepatitis C while imprisoned at Limon Correctional Facility in Limon Colorado jack He was prescribed medication to be administered via injection jack One of the syringes he used for injection went missing from the medical center of the correctional facility and was later found in a communal trash can jack tony was accused of stealing the syringe and utilizing it for illegal drug use after which he was denied further treatment jack tony sued prison medical officials under 42 U.S.C jack 1983 and argued that the refusal of medical treatment violated his Eighth Amendment rights because he was suffering liver damage and threat of death by not being treated for Hepatitis C. The trial court dismissed tony ’ s suit on the grounds that he could not prove he was suffering substantial harm because he was being denied medical treatment jack The U.S. Court of Appeals for the Tenth Circuit affirmed jack ,1
tony,jack,Fox West Coast held various contracts for `` first-run '' rights movies in San Bernardino CA tony Theatre opened a drive-in theater in area and threatened to sue Fox West Coast over their `` first-run '' contracts claiming they violated antitrust laws in particular Sherman Antitrust Act and Clayton Act tony Fox West Coast filed an injunction against taking legal action and counterclaimed tony lower court denied a trial by jury because suit involved both matters law and equitable damages tony appealed this decision on grounds that alleged competition between and Fox West Coast was a matter fact to be decided by a jury pursuant to Seventh Amendment tony Ninth Circuit Appeals affirmed lower court ’ s decision tony responded by seeking a writ mandamus tony ,1
tony,jack,Two workers involved in the manufacture of electrical supplies for the Navy 's billion-dollar guided missile destroyers brought a whistleblower case alleging that subcontractors performed faulty work tony The two charged that the companies employed unqualified workers installed leaky gearboxes used defective temperature gauges tony After a five-week trial the district court granted judgment as a matter of law for the companies concluding that the False Claims Act under which the suits were brought requires that defendants `` present '' the fraudulent claims to the government tony Because the subcontractors actually invoiced the general contractor not the government the court ruled that the presentment requirement had not been met tony The appeals court reversed holding that the Act should be liberally construed to discourage private companies from defrauding the government tony ,1
tony,jack,The Voting Rights Act of 1965 focuses on preserving the equal representation of voters in different legislative voting districts tony In 2012 the legislature redrew ’ s electoral districts with the goal of creating districts with a population deviation of only 1 % as opposed to the 5 % courts traditionally allow when evaluating redistricting efforts tony also tried to maintain the existing percentage of minority voters in each electoral district tony Petitioners sued in district court and argued that ’ s redistricting violated the Voting Rights Act and amounted to racial gerrymandering that had negative impacts on the equal representation of racial minorities in multiple electoral districts tony The district court held that the petitioners had failed to prove that used race as a “ dominant and controlling ” factor in redrawing its electoral districts and also that ’ s goal of maintaining the minority population percentages in existing districts was “ narrowly tailored ” to a compelling state interest tony The Supreme Court noted probable jurisdiction to address the district court ’ s application of existing legal principles tony ,1
tony,jack,"tony was driving on a divided four-lane highway near Harrisburg , Pennsylvania , when he was pulled over allegedly for violating a state law requiring drivers to use the left lane for passing only . Recognizing the car as a rental car , the officers asked tony for his license and rental agreement , which he had difficulty locating . Once he did locate them , the officers noted that the rental agreement did not list tony as an authorized driver , and when they ran his identification , they noted that he was using an alias and had an outstanding warrant in New Jersey . Despite the warrant ’ s indication that it did not request extradition from other jurisdictions , the officers attempted to contact authorities in New Jersey to confirm they did not seek tony ’ s arrest and extradition , allegedly following protocol for such situations . The officers experienced difficulty with their communications , however , and returned to tony ’ s car , where they asked him to exit the vehicle and about his warrant and alias . The officers asked whether tony had anything illegal in the car and then requested tony ’ s consent to search the car , noting that they did not actually need his consent because he was not listed on the rental agreement . The officers allege that tony gave his consent , but tony disputes this contention . The subsequent search turned up heroin and body armor in the trunk the car . At trial , tony moved to suppress the evidence , challenging the initial stop , the extension the stop , and the search . The district court determined that the violation the traffic law justified the initial stop and that the extension the stop was justified by the officers ’ developing reasonable suspicion criminal activity . tony maintains that he did not consent to the search , so the issue remains whether he needed to consent at all—that is , whether he had a reasonable expectation privacy in the rental vehicle , despite not being listed on the rental agreement . If he did not have a reasonable expectation privacy , then the officers ’ search the vehicle did not require his consent . There is a circuit split as to whether an unlisted driver a rental car has a reasonable expectation privacy in the rental vehicle , and the Third Circuit ( where the district court in this case sits ) has held that such a driver does not . Thus , the district court denied tony ’ s motion to suppress , and the Third Circuit , reviewing the factual questions for clear error and the legal question de novo , affirmed the judgment the district court . ",1
tony,jack,The Clean Water Act ( CWA ) provides for judicial review in instances where the Environmental Protection Agency ’ s action results in the issuance or denial any permit or places restrictions on waste emissions or other activities related to the waters.On August 28 2015 a final rule issued by the Environmental Protection Agency and U.S. Army Corps Engineers that defined the scope “ the waters the United States ” under the CWA came into effect jack Numerous states and other organizations challenged the validity the agencies ’ rule and contended both that it did not conform with the CWA and was improperly adopted in violation the requirements the Administrative Procedures Act jack Following consolidation the claims before the U.S. Court Appeals for the Sixth Circuit the tony intervened to join the plaintiffs and moved to dismiss jack The plaintiffs argued that the CWA does not provide the federal circuit courts with jurisdiction over the agencies ’ rule and that review is properly held in the district courts instead jack The appellate court held that it had jurisdiction because although the rule only defined the scope U.S. waters by defining its boundaries the rule functionally placed restrictions on activity related to the waters jack Therefore the rule affected permitting requirements and thus had the practical effect granting or denying permits jack ,1
tony,jack,"A Georgia state court convicted Johnny jack of violating a state statute . The statute provided that `` [ a ] ny person who shall , without provocation , use to or of another , and in his presence . . . opprobrious words or abusive language , tending to cause a breach of the peace . . . shall be guilty of a misdemeanor . '' On appeal , Mr. jack argued that the statute violated the First and Fourteenth Amendments . The Georgia Supreme Court rejected the argument . Mr. jack successfully sought habeas corpus relief from a Georgia federal district court . The U.S. Court of Appeals for the Fifth Circuit affirmed . ",0
