first_party,second_party,facts,first_party_winner
tony,jack,In 2016 Citibank initiated a debt-collection action in a North Carolina state court against jack alleging that jack had failed to pay for a water treatment system he purchased using a Citibank-issued credit card tony In responding to Citibank ’ s complaint jack asserted a counterclaim against Citibank and third-party class-action claims against and Carolina Water Systems ( CWS ) tony In these third-party claims jack alleged that and CWS had engaged in unfair and deceptive trade practices with respect to the water treatment systems ; jack ’ s counterclaim against Citibank alleged that Citibank was jointly and severally liable to him because had sold or assigned the transaction to Citibank tony Citibank subsequently dismissed its claims against jack tony filed a notice of removal in federal court citing federal jurisdiction under the Class Action Fairness Act ( CAFA ) tony then filed a motion to realign parties with jack as plaintiff and CWS and Citibank as defendants tony jack moved to remand the case to state court and amended his third-party complaint to remove any reference to Citibank tony The district court denied ’ s motion to realign parties finding that there were not “ antagonistic parties on the same side ” and granted jack ’ s motion to remand because was not a “ defendant ” eligible to remove under CAFA tony The US Court of Appeals for the Fourth Circuit affirmed finding that the district court properly declined to realign the parties because the purpose of realignment—to prevent parties from fraudulently manufacturing diversity jurisdiction—was not implicated in the dispute tony Moreover the Fourth Circuit found that allowing to remove would be inconsistent with its prior interpretations of CAFA ’ s removal statute tony ,0
tony,jack,"These are two consolidated cases . In 81 , tony was arrested in his house in 1967 . Police searched the house for an hour and 45 minutes , discovering heroin on a shelf in a bedroom . The heroin was admitted at trial and tony was convicted of concealing illegally imported heroin . tony appealed , arguing that the search of his house was illegal under Chimel v. California , a case decided on June 23 , 1969 that narrowed the permissible scope of searches incidental to an arrest . The U.S. Court of Appeals for the Ninth Circuit affirmed , holding that Chimel did not apply retroactively , and the search was valid under pre-Chimel standards . In 82 , Joseph Elkanich was convicted on three counts of selling narcotics in 1962 . At trial , evidence included marked bills planted by a federal narcotics agent . The bills were seized during a search of Elkanich ’ s apartment after his arrest . The arrest and search were upheld at trial and on appeal and the U.S. Supreme Court denied certiorari . Elkanich then unsuccessfully applied for post-conviction relief in the district court . While the appeal of that decision was pending , < i > Chimel < /i > was decided . The U.S. Court of Appeals for the Ninth Circuit affirmed the district court . ",0
tony,jack,In November 1996 several other African Americans filed class action lawsuit in federal district court against R.R . commercial printing company . They claimed they had suffered racial discrimination in violation section 1981 United States Code ( U.S.C . ) which had no specified statute limitations . however argued that the section was bound by two-year statute limitations established by Illinois for all personal injury claims . The suit fell outside that statute limitations the company argued that it should therefore be dismissed . however argued that separate section U.S.C . extended the statute limitations to four years for any civil suit brought under an act Congress passed after 1990 . Because the 1991 Civil Rights Act had broadened the definition section 1981 she argued the four-year statute limitations should apply to that section the suit should therefore not be thrown out . countered that the 1991 Civil Rights Act had merely amended the section not created new law that the four-year statute limitations therefore did not apply . A federal district court sided with . A Seventh Circuit Court Appeals panel unanimously reversed . ,1
tony,jack,tony wanted to use his hovercraft on Nation River which runs through ’ s Yukon-Charley Preserve conservation unit designated such by Interest Lands Conservation Act ( ANILCA ) 16 U.S.C jack § 3101 seq. to reach moose hunting grounds jack The State would permit him to do so whereas federal government would not pursuant to regulations jack tony argued that Nation River belonged to and that could not regulate or prohibit use hovercraft on that portion river jack tony sought declaratory and injunctive relief barring from enforcing its hovercraft ban jack The district court and appellate court denied him relief interpreting statute limiting ’ s authority to impose Alaska-specific regulations on inholdings but not its authority to enforce nationwide regulations like hovercraft rule jack The US Supreme Court rejected this interpretation and remanded case for further consideration jack On remand from US Supreme Court Ninth Circuit concluded that Nation River was public land for purposes ANILCA and thus that it was subject to regulatory authority jack ,1
tony,jack,"In an effort to investigate the `` administration , operation , and enforcement '' of the Internal Security Act of 1950 , the Senate Subcommittee on Internal Security subpoenaed a bank for the financial records of the jack . This nonprofit organization had actively published newsletters and sponsored coffeehouses in which discussions critical of the Vietnam War took place . The jack challenged the subpoena arguing that its enforcement would violate the organization First Amendment rights since the bank records contained information about the jack membership . ",1
tony,jack,Low Income Tax Credits are federal tax credits distributed to low-income housing developers through an application process the distribution is administered by state housing authorities tony In 2009 the ( ICP ) a non-profit organization dedicated to racial economic integration communities in the Dallas area sued the tony ( TDHCA ) which administers the Low Income Tax Credits within tony ICP claimed that TDHCA disproportionately granted tax credits to developments within minority neighborhoods denied the credits to developments within Caucasian neighborhoods tony ICP claimed this practice led to a concentration low-income housing in minority neighborhoods which perpetuated segregation in violation the Fair Act tony At trial ICP attempted to show discrimination by disparate impact the district court found that the statistical allocation tax credits constituted a prima facie case for disparate impact tony Using a standard for disparate impact claims that the U.S. Court Appeals for the Second Circuit articulated in Town Huntington v. Huntington Branch the court then shifted the burden to TDHCA to show the allocation tax credits was based on a compelling governmental interest no less discriminatory alternatives existed tony TDHCA was unable to show no less discriminatory alternatives existed so the district court found in favor ICP tony TDHCA appealed to the U.S. Court Appeals for the Fifth Circuit claimed that the district court used the wrong standard to evaluate disparate impact claims tony appellate court affirmed held that the district court 's standard mirrored the standard promulgated by the Department Urban Development the agency tasked with implementing the Fair Act tony ,0
tony,jack,"During Duyonn jack 's trial , defense counsel moved for a directed verdict of acquittal as to first-degree murder . Subsequently , when the prosecution made a statement on first-degree murder , defense counsel objected , arguing that the court had granted its directed verdict motion and that further prosecution on first-degree murder would violate the Double Jeopardy Clause . The judge responded that he had granted the motion but had not directed a verdict . The judge then submitted the first-degree murder charge to the jury , which convicted jack on that charge . The Michigan Court of Appeals reversed the conviction based on the Double Jeopardy Clause . In reversing , the State Supreme Court determined that the trial judge 's comments were not sufficiently final to terminate jeopardy . Subsequently , the Federal District Court granted jack 's federal habeas corpus petition after concluding that continued prosecution for first-degree murder had violated the Double Jeopardy Clause and the Court of Appeals affirmed . ",1
tony,jack,"The Farm Credit Act 1933 created various lending institutions , including banks for cooperatives , which are designated as federally chartered instrumentalities the United States . jack is the successor to all rights and obligations the National Bank for Cooperatives . In 1996 , filed amended returns on behalf that bank , requesting an exemption from all tony corporate income taxes and refunds on the taxes it paid for 1991 through 1994 . asserted that the Supremacy Clause accords federal instrumentalities immunity from state taxation unless Congress has expressly waived this immunity , which the Act did not expressly do . The state tony denied the request , but the State Supreme Court reversed , stating that because the Act 's current version is silent as to the banks ' tax immunity , Congress can not be said to have expressly consented to state income taxation and , thus , the banks are exempt . ",1
tony,jack,"Stanley I. jack and other retired employees of tony were beneficiaries of Non-Bargaining Retirement Plan . jack and the others claimed in their class-action lawsuit that violated the Employee Retirement Income Security Act of 1974 ( ERISA ) , the federal pension protection law , when it amended the plan twice in response to a $ 1.2 billion dollar surplus . ERISA requires that some of the surplus be distributed to cover employees when a pension plan is terminated . ' first amendment to the plan established an early retirement program that provided significant additional retirement benefits to certain eligible active employees . The second amendment disallowed new participants from contributing to the plan . jack and others argued that had terminated one plan and started another by stopping its pension plan contributions . Thus , the company had used the plan 's surplus to benefit new employees at the expense of the retirees . The District Court dismissed the complaint for failure to state a claim . The Court of Appeals reversed the District Court by finding that the early retirement program and noncontributory benefit structure were prohibited by the ERISA . ",1
tony,jack,"died lung cancer at age 67 after a life spent smoking three packs Marlboro cigarettes per day . His widow sued Phillip maker Marlboro cigarettes alleging that company had engaged in a deliberate wide-spread campaign misinformation on dangers smoking . The jury found for and awarded her $ 821,485.50 in compensatory damages and $ 79.5 million in punitive damages . However trial judge found punitive damages excessive and reduced them to $ 32 million . Under Supreme Court 's decision BMW v. Gore punitive damages must be reasonably related to harm done to plaintiff but larger punitive damage awards may be appropriate if defendant displayed reprehensible conduct . Citing Gore Oregon Court Appeals reinstated $ 79.5 million award holding that Phillip 's conduct was reprehensible enough to warrant large amount . The Oregon Supreme Court declined to take case . However U.S. Supreme Court sent case back for consideration in light State Farm v. Campbell which held that punitive damages can normally only be as much as nine times greater than compensatory damages . The Oregon Court Appeals again affirmed $ 79.5 million award ruling that reprehensibility Phillip 's conduct justified larger ratio . The Oregon Supreme Court upheld decision . Phillip appealed to Supreme Court arguing that court had unreasonably exceeded federal guidelines on punitive damages . Phillip also argued that it was unfair to punish company for its actions toward other smokers who were not parties to suit . ",1
tony,jack,In 2012 the Virginia State Legislature adopted a redistricting plan that altered the composition of the Third Congressional District which was already majority African-American and increased the percentage of African-American voters in the district tony Pursuant to Section 5 of the Voting Rights Act the plan was submitted to the Department of Justice for preclearance which was granted tony On October 2 2013 plaintiffs sued the defendants in their official capacities and argued that Virginia ’ s Third Congressional District was racially gerrymandered in violation of the Equal Protection Clause of the Fourteenth Amendment tony The district court ruled that the districting plan was unconstitutional because its use of race as a factor was not sufficiently narrowly tailored to serve a compelling government interest tony The defendant Commonwealth of Virginia did not appeal ; instead ten members of Congress who had intervened in the case at the trial level appealed to the U.S. Supreme Court which remanded the case for reconsideration in light of its decision in Alabama Legislative Black Caucus v. Alabama tony In that case the Court held that the Voting Rights Act does not require a legislature to maintain a particular minority number percentage in creating a districting plan but rather it requires that the legislature maintain a minority ’ s ability to elect a candidate of choice tony In considering whether a districting plan is unconstitutional courts must examine whether racial considerations predominated over nonracial ones in determining which voters to place in which district tony On remand the district court again determined that the Third Congressional District was unconstitutional because racial considerations predominated in creating the plan tony ,0
tony,jack,"In 1989 , the U.S. Supreme Court held that Johnny Paul tony had been sentenced to death in violation of the Eighth Amendment after finding that Texas ' special issues questions did not permit the jury to consider mitigating evidence involving his mental retardation . On retrial in 1990 , tony was again found guilty of capital murder . The defense again put on extensive evidence regarding tony 's mental impairments . Ultimately , a psychiatric evaluation , which stated that tony would be dangerous to others if released , prepared at the request of tony 's former counsel , was cited . Upon submission to the jury , the trial judge instructed the jury to determine tony 's sentence by answering the same special issues in the original tony case . Additionally , the trial judge gave a supplemental instruction on mitigating evidence . The court sentenced tony to death in accordance with the jury 's answers to the special issues . In affirming , the Texas Court of Criminal Appeals rejected tony 's claims that the admission of language from the psychiatric evaluation violated his Fifth Amendment privilege against self-incrimination , and that the jury instructions were constitutionally inadequate because they did not permit the jury to consider and give effect to his particular mitigating evidence . tony 's petitions for state and federal habeas corpus relief failed . ",1
tony,jack,"In 1972 , twenty one states were members of the Compact , a body formed by states to assist them in formulating and administering tax law relating to multistate businesses . The Compact had not received congressional approval . ",0
tony,jack,Inc. provides home health care services to Medicare beneficiaries tony Under the Medicare Act providers seeking reimbursement for covered health services submit a yearly cost report to a fiscal intermediary usually a private insurance company tony The intermediary then issues a Notice of Program Reimbursement ( NPR ) determining the provider 's reimbursement tony The Act allows the provider up to 180 days to appeal a reimbursement determination to the Provider Reimbursement Review Board tony The provider also has up to three years to ask the intermediary to reopen a determination of the Board tony submitted cost reports for 1989 to its intermediary and did not appeal the reimbursement decision tony However within three years asked its intermediary to reopen its 1989 reimbursement determination on the ground that `` new and material '' evidence demonstrated entitlement to additional compensation tony The intermediary denied the request tony appealed the denial to the Board which dismissed the appeal on the ground that lacked it jurisdiction to review an intermediary 's refusal to reopen a reimbursement determination tony then brought action in Federal District Court seeking review of the Board 's dismissal and of the intermediary 's refusal to reopen tony The District Court agreed that the Board lacked jurisdiction to review the refusal to reopen tony Moreover it rejected 's contention that the federal-question statute or the mandamus statute gave the District Court jurisdiction to review the intermediary 's refusal directly tony Subsequently the court dismissed the complaint tony The Court of Appeals affirmed tony ,0
tony,jack,"In December 1938 tony Thomas conveyed approximately 8,711 acres of land in Plaquemines Parish tony Louisiana to the . deed contained a mineral reservation under which retained the right to mine and remove all valuable minerals until April 1 tony 1945 . deed allowed for the extension of this reservation for an additional five years so long as operations were conducted profitably during the previous five years for an average of fifty days a year . If at the end of the original term or an additional extended term the operation had not carried on for fifty days a year tony ’ s right to mine would terminate tony and complete title would become vested in the . No mineral operations were conducted on the land in question during the original term . On March 1 tony 1949 tony the conveyed the operating rights under lease to Frank J. and Albert jack tony who then conveyed those rights to . drilled and completed eighty wells tony producing $ 3,500,000 in royalties for the . tony then filed an action in state court against jack and based on a Louisiana law allegedly making a reservation of mineral rights to the “ imprescriptible ” . was not a party to the suit . claimed that it was the fee simple owner of all the oil tony gas and mineral rights in or on the land acquired by the from Thomas . then brought an action in district court ; it sought to quiet ’ title and rights and to enjoin from further asserting any claims in state court . argued in part that irreparable injury in the form of lost royalties would result from any dispossession to its lessees . district court granted the injunction tony holding that the action could only be tried in federal court because the was not a party to the state court action . ",0
tony,jack,In two separate cases employees sued Barber Foods in federal district court tony The employees alleged the companies violated the Fair Labor Standards Act by not paying them for time spent walking to the worksite after putting required equipment tony The district court later the First Circuit ruled against the Barber employees tony A separate district court ruled must compensate its employees for the disputed time tony The Ninth Circuit agreed tony The U.S. Supreme Court consolidated the cases tony ,0
tony,jack,houses `` incorrigible recalcitrant '' prisoners in the Long Term Segregation Unit ( LTSU ) was one about 40 prisoners in level 2 the LTSU which is reserved for the most dangerous worst-behaved inmates It is the policy the LTSU to impose severe restrictions on the privileges level 2 inmates In particular level 2 prisoners are the only ones denied newspapers magazines photographs the the PA tony argued that this policy was necessary to promote rehabilitation ensure prison safety brought a suit challenging the policy as a violation the First Amendment the recommendation a Magistrate Judge the District Court ruled in favor appeal however the Third Circuit Court Appeals reversed The Circuit Court found that the prison 's policy failed to meet the test laid down by the Supreme Court in Turner v. Safley The Third Circuit held that the First Amendment rights the prisoners took precedence because the policy was unrelated to the goal rehabilitation an ineffective method increasing prison safety ,1
tony,jack,"On April 4 , 1962 , black citizens jack , Alabama were engaged in a boycott downtown department stores ; the jack police -- including Patrolman Byars -- were aware the boycott . At about 10:30 A.M. , Byars observed a group four to six people including noted activist tony walking toward the intersection 19th Street and Second Avenue , the location the front entrance Newberry ’ s Department Store . Byars walked through Newberry ’ s and through the front entrance , where he observed a group ten or twelve people congregated in one area . They were standing and talking with tony apparently at the center the conversation . Byars observed the group for a minute or so from inside Newberry ’ s , then left the store and told the group to move on and clear the sidewalk . Some the group began to leave . Byars repeated his command , and tony asked , “ You mean to say we can ’ t stand here on the sidewalk ? ” Three more officers arrived on the scene , and Byars told the group that they would have to clear the sidewalk or he would arrest them for obstructing its use . By this point , only tony remained at the scene . tony repeated his question , and Byars told him he was under arrest . tony then attempted to walk into Newberry ’ s , but Byars followed him in and arrested him . tony offered no resistence . On April 5 , tony was tried in the recorder ’ s court the city jack . The court charged him with obstructing free passage on the sidewalk and with refusing to comply with a police order to move on in violation two sections the jack General Code . He was sentenced to 180 days hard labor and $ 100 fine and costs . He appealed for a trial de novo in the district court . Byars ’ initially testified that the group ’ s presence impeded pedestrian traffic , but on cross-examination he testified that the group only blocked off about half the sidewalk . The court affirmed tony ’ s conviction , rejecting his assertions that the ordinance was unconstitutionally vague and overbroad , that the prosecution ’ s case was not supported by evidence , and that Shuttleworth ’ s conduct was protected by the First and Fourteenth Amendments . The Alabama Court Appeals affirmed tony ’ s conviction , holding the evidence sufficient to support the verdict . The Alabama Supreme Court denied tony ’ s applications for certiorari and rehearing . ",1
tony,jack,"The Commonwealth of Virginia charged Tommy David tony with capital murder and related crimes . tony 's counsel did not file a pretrial motion for discovery of all possible exculpatory evidence under Brady v. Maryland because an open file policy gave him access to all of the evidence in the prosecutor 's files . At tony 's trial , Anne Stoltzfus gave detailed eyewitness testimony about the crimes and tony 's role as one of the perpetrators . The prosecutor failed to disclose exculpatory materials in the police files , consisting of notes taken by a detective during interviews with Stoltzfus , and letters written by Stoltzfus to the detective , that cast serious doubt on significant portions of her testimony . The jury found tony guilty and he was sentenced to death . The Virginia Supreme Court affirmed . In subsequent state habeas corpus proceedings , tony advanced an ineffective assistance of counsel claim based on trial counsel 's failure to file a motion for disclosure of all exculpatory evidence known to the prosecution or in its possession under Brady . In response , the Commonwealth asserted that such a motion was unnecessary because of the prosecutor 's open file policy . The trial court denied relief and the Virginia Supreme Court affirmed . tony then filed a federal habeas corpus petition and was granted access to the exculpatory Stoltzfus materials . The District Court vacated tony 's capital murder conviction and death sentence on the grounds that the Commonwealth had failed to disclose those materials and that he had not , in consequence , received a fair trial . In reversing , the Court of Appeals held that tony had procedurally defaulted his Brady claim by not raising it at his trial or in the state collateral proceedings . Ultimately , the court concluded that the claim was , in any event , without merit . ",0
tony,jack,"After immigration agents found 30 kilograms of marijuana in Angela jack 's luggage , federal prosecutors offered her a `` fast track '' plea bargain in which she would waive indictment , trial , and an appeal in exchange for a reduced sentence recommendation . The prosecutors ' offer requires that the defendant waive the right to receive impeachment information relating to any informants or other witnesses , as well as information supporting any affirmative defense she raises if the case goes to trial . When jack rejected the waiver , the prosecutors withdrew their offer , indicted her for unlawful drug possession , and she pleaded guilty . At sentencing , jack asked the judge to grant her the same reduced sentence that the Government would have recommended had she accepted the plea bargain . The Government opposed her request , and the District Court denied it . In vacating the sentence , the Court of Appeals ruled that the Constitution prohibits defendants from waiving their right to certain impeachment information . ",1
