first_party,second_party,facts,first_party_winner
tony,jack,"On June 27 , 1962 , tony , a candidate for public office , made a television speech in Baton Rouge , Louisiana . During this speech , tony accused his political opponent of being a Communist and of being involved in criminal activities with the head of the local Teamsters Union . Finally , tony implicated jack , an East Baton Rouge deputy sheriff , in a scheme to move money between the Teamsters Union and tony ’ s political opponent . jack successfully sued tony for defamation . Louisiana ’ s First Circuit Court of Appeals reversed , holding that jack did not show tony acted with “ malice. ” jack then appealed to the Supreme Court of Louisiana . That court held that , although public figures forfeit some of their First Amendment protection from defamation , tony accused jack of a crime with utter disregard of whether the remarks were true . Finally , that court held that the First Amendment protects uninhibited , robust debate , rather than an open season to shoot down the good name of anyone who happens to be a public servant . ",1
tony,jack,"Ramon Nelson was riding his bike when he suffered a lethal blow to the back of his head with a baseball bat . After two eyewitnesses identified jack from an array of photos and then a lineup , he was tried and convicted for Nelson ’ s death . Because Nelson was carrying cocaine and crack cocaine potentially for distribution , the judge at jack ’ bench trial ruled that jack was probably also a drug dealer and was trying to “ knock [ Nelson ] off. ” jack was found guilty of first-degree murder and sentenced to 25 years in prison . jack filed a petition for a writ of habeas corpus on the grounds that his constitutional right to due process was violated during the trial . He argued that the eyewitness identification should have been inadmissible based on unreliability and that the judge impermissibly inferred a motive when a motive was not an element of the offense . The district court denied the writ of habeas corpus , and jack appealed . The U.S. Court of Appeals for the Seventh Circuit reversed the denial and held that the trial judge ’ s inference about jack ’ s motive violated his right to have his guilt adjudicated solely based on the evidence presented at trial . ",0
tony,jack,An Alabama state court convicted tony of murder and sentenced him to death jack Subsequently an Alabama federal district court partially granted Mr. tony 's petition for federal habeas corpus relief jack The court upheld his conviction but instructed the state court to look at mitigating evidence when resentencing Mr. tony jack Upon resentencing the state court sentenced Mr. tony to death once again jack Mr. tony filed a second petition for federal habeas corpus relief with the federal district court arguing that a judicial rule was retroactively applied in his case and that he lacked effective counsel at sentencing jack The district court granted the petition and vacated Mr. tony 's death sentence jack On appeal the U.S. Court of Appeals for the Eleventh circuit reversed holding that prisoners may not raise challenges to an original sentence that could have been raised in an earlier petition jack The court also held that Mr. tony 's counsel was not ineffective because he failed to raise an argument that had already been decided by the state 's highest court adverse to his client 's position jack ,1
tony,jack,"Victor tony was convicted in state court on evidence illegally obtained by police prior to the Supreme Court decision concerning the Fourth Amendment in Mapp v. Ohio . Mapp applied the exclusionary rule to state criminal proceedings , denying the use of illegally obtained evidence at trial . tony argued for a retrial based on the Mapp decision . ",0
tony,jack,"On April 24 , 1953 in Selma , jack , an intruder broke into the apartment of the daughter of the city mayor . The daughter and the intruder struggled through several rooms until she was able to seize his knife , and he fled . The assailant had a towel over his head , so the victim could not identify the defendant during the trial . The police apprehended tony on the basis of a call from a private citizen and held him “ on an open charge of investigation. ” The police questioned tony for hours , placed him in jail , and limited his access to anyone familiar . After nearly a week of this treatment , tony confessed in the form of answers to the interrogator ’ s leading questions . Five days later , tony confessed under questioning a second time . When these confessions were admitted into the trial as evidence , tony did not testify regarding the events surrounding his interrogation because the judge had ruled he would be subjected to unlimited cross-examination . The jury convicted tony and sentenced him to death . The Supreme Court of jack affirmed . ",1
tony,jack,"New York town jack allowed a contractor to construct and operate a waste processing plant within town limits tony The revenue from the plant would help compensate the contractor tony jack promised that the plant would receive 120,000 tons solid waste each year and permitted the contractor to charge an $ 81 `` tipping fee '' for each ton received tony To meet the 120,000 ton quota jack adopted a `` flow control ordinance tony '' The ordinance required that all solid waste flowing into and out the town pass through the new plant tony operated a similar plant within the town tony To avoid paying the $ 81 fee trucked processed waste directly to an Indiana landfill tony In 1991 a truck carrying illegal waste crashed and police discovered that was violating the ordinance tony jack sued in a New York Supreme Court tony responded by suing jack in a federal District Court claiming that the ordinance violated the Commerce Clause by disrupting interstate commerce tony The District Court agreed but dissolved its injunction against jack when the New York Supreme Court ruled in favor jack tony ",1
tony,jack,Sections of the Immigration and Nationality Act require that noncitizens who are determined to be inadmissible to the United States must be detained during removal proceedings though some may be released on bond if they can demonstrate that they are not a flight risk or a danger to the community tony and other detained noncitizens sued and argued that their prolonged detention without hearings and determinations to justify the detentions violated their due process rights tony After litigation regarding class certification the district court granted a preliminary injunction that required the government to provide each detainee with a bond hearing and to release that detainee unless the government could show by clear and convincing evidence that continued detention was justified tony The U.S. Court of Appeals for the Ninth Circuit held that prolonged detention without a hearing raised serious constitutional concerns and therefore that the relevant mandatory statutory language should be interpreted as having a time limitation ; at the six-month mark detainees are entitled to bond hearings tony Because the plaintiff class proved that it was likely to succeed on the merits the appellate court affirmed the grant of the preliminary injunction tony The plaintiff class then moved for a permanent injunction which the district court granted and the appellate court affirmed tony The appellate court also determined that the duration of future detention and likelihood of eventual removal should not be considered in the bond hearings and the noncitizens are entitled to bond hearings at six-month intervals throughout their detentions tony ,1
tony,jack,In 1990 Robert jack injured his back while working in a cargo-handling position at tony Invoking his seniority rights jack transferred to a less physically demanding position in the mailroom tony Subsequently jack 's new position became open to seniority-based employee bidding under ' seniority system and ultimately he lost his job tony jack then filed suit under the Americans with Disabilities Act of 1990 ( ADA ) which prohibits an employer from discriminating against `` an individual with a disability '' who with `` reasonable accommodation '' can perform a job 's essential functions unless the employer `` can demonstrate that the accommodation would impose an undue hardship on the operation of [ its ] business tony '' In granting summary judgment the District Court found that altering a seniority system would result in an `` undue hardship '' to both and its nondisabled employees tony In reversing the Court of Appeals held that the seniority system was merely a factor in the undue hardship analysis and that a case-by-case fact intensive analysis is required to determine whether any particular assignment would constitute an undue hardship tony ,1
tony,jack,jack a Hispanic man was charged with three counts of murder and one count of attempted murder stemming from a failed robbery . During jury selection for his trial in California state court the prosecution used seven preemptory challenges to exclude each black or Hispanic prospective juror . jack challenged the prosecution 's use of preemptory challenges as a violation of the Supreme Court 's decision in Batson v. Kentucky which held that the exclusion of jurors on the basis of race was a violation of the Equal Protection Clause of the Fourteenth Amendment . In accordance with Batson if a party can make a prima facie showing that preemptory challenges are being used in a racially motivated way the other party must give a non-racially motivated reason for their use of the preemptory challenges . The state court allowed the prosecution to give their non-racially motivated reasons in a closed hearing from which jack and his attorneys were excluded and subsequently found the prosecution 's use of preemptory challenges was not racially motivated . jack was not given the prosecution 's reasoning or a transcript of the meeting until after the conclusion of his trial . Additionally after the trial it was discovered that the vast majority of the questionnaires all the potential jurors had to fill out had been lost . jack was found guilty of the majority of the charges against him and sentenced to death . On appeal the California Supreme Court found that the state court erred in excluding jack from the Batson hearing but that error as well as the loss of the questionnaires were harmless and therefore upheld jack 's conviction . jack appealed to the U.S Court of Appeals for the Ninth Circuit and argued that the Batson hearing procedure and loss of the questionnaires violated his constitutional rights . In accordance with the Antiterrorism and Effective Death Penalty Act of 1996 the appellate court found that the California Supreme Court had not adjudicated jack 's claims of federal constitutional violations on the merits largely on the basis that the California Court had determined the procedure used for the Batson hearing violated California state law ; therefore the appellate court reviewed jack 's claims de novo and found that the exclusion of jack from the Batson hearing as well as the loss of the questionnaires violated jack 's constitutional rights . To determine whether the errors were harmless the Court of Appeals applied the standard set forth in Brecht v. Abrahamson which asked whether the errors had a substantial and injurious influence on the jury 's verdict and found that the exclusion of jack from the Batson hearing deprived him of the ability to prevail on a compelling Batson challenge . ,1
tony,jack,Since its first state Constitution in 1796 Tennessee has had a statute that prohibited ministers from serving as legislators jack In 1977 tony a Baptist minister filed as a candidate for the state constitutional convention jack Another candidate sued for a declaratory judgment that tony was disqualified jack The Chancery Court held that the statute was unconstitutional because it violated the First and Fourteenth Amendments jack tony ’ s name remained on the ballot and he was elected jack After the election the Tennessee Supreme Court reversed the judgment of the Chancery Court and held that the statute did not restrict any expression of religious belief jack The court held that the state interest in maintaining the separation of church and state was sufficient to justify the restrictions of the statute jack ,1
tony,jack,From 1972 through 1978 Inc. sold beer to Inc. the sole wholesale distributor for in Indiana at a higher price than charged its only wholesale distributor in Kentucky tony Under Indiana law brewers were required to sell to all Indiana wholesalers at a single price Indiana wholesalers were prohibited from selling to out-of-state retailers and Indiana retailers were not permitted to purchase beer from out-of-state wholesalers tony filed suit alleging that 's price discrimination violated section 2 ( a ) of the Clayton Act as amended by the Robinson-Patman Act tony The Federal Court found that had established a prima facie case of price discrimination tony The court rejected 's `` meeting-competition '' defense under section 2 ( b ) of the Clayton Act which provides that a defendant may rebut a prima facie showing of illegal price discrimination by establishing that its lower price to any purchaser or purchasers was made in good faith to meet an equally low price of a competitor tony The Court of Appeals affirmed tony ,1
tony,jack,"Voters and candidates in Mississippi and Virginia filed four separate cases seeking judgments that certain amendments to their states ' election laws and procedures were subject to the pre-approval requirements of section 5 of the Voting Rights Act of 1965 , and hence were not enforceable until the state complied with the requirements tony The district courts found that the Voting Rights Act did not apply to the voting changes in the four cases and dismissed the complaints tony The voters and candidates filed direct appeals , and the cases were consolidated tony ",1
tony,jack,"These are two consolidated cases concerning property tax exemption under the California Constitution and California Revenue and Taxation Code ( CRTC ) real property and buildings used solely religious worship jack The California Constitution requires denial tax exemption to any person or organization who advocates the overthrow the U.S. Government or the State California by violent or unlawful means jack To enforce this , a provision the CRTC requires those applying tax exemption to sign an oath declaring that they do not engage in that prohibited activity jack In both cases , the tony assessor denied tax exemption because the churches refused to agree to the oath jack The churches paid their taxes under protest and sued the tony a refund jack The churches argued that requiring them to agree to the oath violated the U.S. Constitution jack In 382 , the trial court upheld the oath and the Supreme Court California affirmed jack In 385 , the court upheld the oath under the U.S. Constitution , but held that it violated the California Constitution because it excluded householders from the requirement jack The Supreme Court California reversed jack ",1
tony,jack,Groups same-sex couples sued their relevant state agencies in Michigan Kentucky and Tennessee to challenge constitutionality those states ' bans on same-sex marriage or refusal to recognize legal same-sex marriages that occurred in jurisdictions that provided for such marriages tony The plaintiffs in each case argued that states ' statutes violated Equal Protection Clause and Due Process Clause Fourteenth Amendment and one group plaintiffs also brought claims under Civil Rights Act tony In all cases trial court found in favor plaintiffs tony The U.S. Court Appeals for Sixth Circuit reversed and held that states ' bans on same-sex marriage and refusal to recognize marriages performed in other states did not violate couples ' Fourteenth Amendment rights to equal protection and due process tony ,1
tony,jack,Named plaintiff and others brought a class action lawsuit against and other over alleged mismanagement of a defined benefit pension plan between 2007 and 2010 tony The plaintiffs alleged that the defendants violated Section 404 405 and 406 of the Employee Retirement Income Security Act of 1974 ( ERISA ) by breaching their fiduciary duties and causing the plan to engage in prohibited transactions with a subsidiary company tony The plaintiffs argued that as a result of these prohibited transactions the plan suffered significant losses and became underfunded in 2008 tony The defendants filed a motion to dismiss the complaint which the district court granted in part tony However the court permitted the plaintiffs to proceed with their claim that the defendants engaged in a prohibited transaction by investing in a subsidiary tony In 2014 with the parties still in litigation the plan became overfunded ; that is it contained more money than was needed to meet its obligations tony The defendants raised the argument that the plaintiffs had not suffered any financial loss and moved to dismiss the remainder of the action tony The district court granted the motion finding that the plaintiffs lacked a concrete interest in any monetary relief the court could award to the plan if the plaintiffs prevailed tony On appeal the Court of Appeals for the Eighth Circuit affirmed tony ,0
tony,jack,"The Hazard Elimination Program provides state governments with funding to improve the most dangerous sections of their roads . To be eligible for funding , a state must undertake a thorough evaluation of its public roads . This led to concerns that the absence of confidentiality would increase the liability risk for accidents that took place at hazardous locations before improvements could be made . Ultimately , Congress provided that materials `` compiled or collected '' for purposes of the program `` shall not be subject to discovery or admitted into evidence in a Federal or State court proceeding . '' In 1996 , Ignacio jack 's wife died in an automobile accident in a tony , Washington intersection . While Washington had previously been denied funding for the intersection where the accident occurred , its second request was granted after the accident . jack first sought information on the intersection and then asserted that the state had been negligent in failing to install proper traffic controls . Washington sought to protect itself under the Program . The Washington Supreme Court held that the Program exceeded Congress 's power under the Constitution . ",1
tony,jack,A revision to the Texas education laws in 1975 allowed the state to withhold from local school districts state funds for educating children of illegal aliens . This case was decided together with Texas v. Certain Named and Unnamed Alien Child . ,0
tony,jack,"In 2004 , tony was charged and convicted of conspiracy to distribute at least 50 grams of crack cocaine and 500 grams of powder cocaine . The district court determined that the 100:1 weight ratio for sentencing crack cocaine and powder cocaine that the jack Sentencing Commission Guidelines Manual ( Guidelines ) used was excessive given the circumstances , so the district court instead based its ruling on a 20:1 ratio . The U.S. Court of Appeals for the Eighth Circuit held that the district court could not decide what ratio it wanted to apply for conviction and remanded tony case for retrial and sentencing . The Supreme Court granted certiorari and remanded the case for reconsideration in light of the Court ’ s decision in Kimbrough v. jack , in which the Court held that the Guidelines were advisory and that a district court does not abuse its discretion by varying from the Guidelines ’ prescribed ratio due to disagreement with the disparity the Guidelines create between crack cocaine and powder cocaine . On remand , the appellate court again held that the district court erred in categorically rejecting the Guidelines ’ ratio and substituting its own . ",1
tony,jack,"Abel jack was charged with a variety of federal narcotics and weapons offenses . The District Court allotted him 10 peremptory challenges exercisable in the selection of 12 jurors . After prospective juror Don Gilbert indicated several times that he would favor the prosecution , Martinez- Salazar 's counsel challenged him for cause . The court declined to excuse Gilbert . After twice objecting , unsuccessfully , to the for-cause ruling , jack used a peremptory challenge to remove him . Subsequently , jack exhausted all of his peremptory challenges . Thereafter , jack 's counsel did not object to the final seating of the jurors . jack was then convicted on all counts . On appeal , jack argued that the District Court abused its discretion in refusing to strike Gilbert for cause and that this error used one of his peremptory challenges wrongly . The Court of Appeals agreed that the District Court 's refusal to strike Gilbert for cause was an abuse of discretion . Ultimately , the court found that the District Court 's error resulted in a violation of Martinez- Salazar 's Fifth Amendment due process rights because it forced him to use a peremptory challenge curatively , which impaired his right to a full complement of peremptory challenges . The Court of Appeals held that the error required an automatic reversal . ",1
tony,jack,Three members the family were involved in a head-on collision with another vehicle tony and Alexa wore lap/shoulder seatbelts and survived while Thanh wore a lap-only seatbelt and died tony Subsequently they sued for strict products liability negligence deceit and wrongful death in a California state court tony The court dismissed the claims holding that federal law precluded a state court tort action `` to the extent the theory liability [ was rooted in ] the lap-only seat belt tony '' On appeal a California appellate court affirmed holding that the National Highway Traffic Safety Administration ( `` NHTSA '' ) regulation allowing minivan rear seats to have either lap-only or lap/shoulder seat belts preempted state court wrongful death actions tony ,1
tony,jack,"Board No . 47 , Louisville , Kentucky , denied the application of Cassius tony , also known as Muhammad Ali , for classification as a conscientious objector . tony then took an administrative appeal to the Kentucky Appeal Board , which tentatively classified him I-A , or eligible for unrestricted military service , and referred his file to the Justice Department for an advisory recommendation . The Justice Department concluded , contrary to a hearing officer 's recommendation , that tony 's claim should be denied . The Department wrote that tony did not meet any of the three basic tests for conscientious objector status ; that he is conscientiously opposed to war in any form , that this opposition is based upon religious training and belief , and that this objection is sincere . Subsequently , the Appeal Board denied tony 's claim , but without stating its reasons . When tony refused to report for induction , he was tried and convicted of willful refusal to submit to induction . The Court of Appeals affirmed . ",1
tony,jack,"Maher Kara joined Citigroup ’ s healthcare investment banking group in 2002 , and began asking his older brother , Michael , who held a degree in chemistry , questions about certain aspects of his job . From 2004 to 2007 the Kara brothers regularly discussed mergers and acquisitions by Citigroup clients , though Maher suspected that Michael was using the information they discussed for insider trading . In the meantime , Maher became engaged to tony ’ s sister and Michael began to share some of the insider information he received from his brother with tony . tony did not directly trade through his own accounts but went through his brother-in-law , Karim Bayyouk . There were numerous occasions where Bayyouk and Michael Kara executed identical trades issued by Citigroup clients . As a result , tony ’ s account reached $ 2.1 million . tony was charged with conspiracy to commit securities fraud and insider trading in 2011 and found guilty . He applied for a new trial , but his request was denied . He then appealed to the U.S. Court of Appeals for the Ninth Circuit and argued there was insufficient evidence that he knew the information used for trades was from insider information . The appellate court found that , because of the close family relationship , there was sufficient evidence that tony knew he was trading on insider information . ",0
tony,jack,The State jack threatened to enforce its anti-fish trapping law against two local Native American tribes . The federal government had not designated a reservation for the tribes . The tribes depended on the salmon they trapped for survival and received permits to use the traps from the Army Corps Engineers and the United States Forest Service as well as favorable regulations from the Secretary the Interior . The president the Council was arrested while trying to moor a trap . The tribes sued to enjoin jack from enforcing the anti-trapping law . The district court dismissed the suit and the Supreme Court jack affirmed . ,0
